{
  "contentHash": "a3f5c2e1b4d6789012345678901234567890abcdef1234567890abcdef123456",
  "creator": "GBRPYHIL2CI3WHZDTOOQFC6EB4RRJC3XNSOLXAUJVLVWXVVNQNYWGLZ",
  "timestamp": "2026-07-29T20:45:00Z",
  "metadata": {
    "device": "iPhone 15 Pro",
    "location": "Lagos, NG",
    "aiModel": "No AI generation used"
  }
}
